Title,Rating,Comment
" Doesn't stick to tiles or bath, falls off constantly",1,Waste of time and money as it wouldn't stay stuck to the tiles or the side of the bath. One hand is 
 Bath,5,Quick service and great item plenty of fun thank you
 Good bath toy,4,I think this could be a bit cheaper so given it 4 stars. But it girl loves it and it makes bath time
 Didn't work,1,Unfortunately it never seemed to make any bubbles .Left it too late to return
 Broke after only a year of casual use..,2,"Broke after only a year of casual use..First the left side panel fell off for no reason, then the Mi"
 Very good,5,"Very good headphones , connect directly to the Xbox with little messing about , very comfortable for"
 Pricey - but worth it,5,"More expensive than others but really cannot fault them, other than being a little tight at times"
 BEWARE! They turn the Xbox on!,1,"I bought the headset with the aim to use it with multiple devices, but they keep turning the Xbox on"
 Worth the extra money over wired,5,"Vast improvement on the wired version of the same headset, would definitely recommend paying extra f"
 Very good sound,5,"Great sound and good price if you want the best sound during gaming as I do, it has Dolby Atmos and "
 Perfect headset for xbox,5,Title says all
 Poorly made,1,Had these for about 6 months and was amazed at how good they where but whilst playing one night the 
 Best Headset,5,I loved the bass on this thing and the sound quality is amazing it also comes with settings on the X
 Great headset next to the Xbox,5,"Easy to setup, microphone is very powerful and audio is pretty clear. Good product."
 Amazing book,5,
 Brilliant gift,5,Our son was given one of these for his 7th birthday and enjoyed it so much! Great for rainy day acti
 Lovely,5,"So good, very good spend of money"
 Daughter loves it,5,My 11 yo daughter loves it!
 Mixed opinion,3,Brought this as a present for a 9 year old! She loved it. I can see why as it had activities to help
" Fun, creative and imaginative",5,"Brought for my 10 year old who's always bored so now when she's bored I tell her to do her journal, "
 Horrible book don’t recommend 👎🏽👎🏽😡😡,1,This product is the worst; pages are too small and I got bored very easily. Don’t buy !!! It is a wa
 Cant do without it,5,Granddaughter cant function without it
 Fantastic,5,Daughter asked for this for her birthday. A keen book lover I knew this book would challenge her! Sh
 Brilliant,5,"Brought as a gift, they love it. Good value for money and good quality. No faults"
 Defective and used,1,The water tank of this item was wet so I wasn't at all surprised when it didn't work properly. Obvio
" Its Ok, Not Great.",4,"Really great wanted one for a while now, the brush accessory doesn’t stay on very well but all in al"
 not the best for curtains.,3,I really didn't want to iron the curtains so I gave it a go. Curtains are cotton but not thick/doubl
 Not even a year old & doesn't work,2,"For the price of it, I would expect to get more than 10 months out of it since its only used to iron"
 Great travel companion,5,Was really surprised by how good this little gadget is. I took it on holiday and did a great job at 
 Spits lots of water with the steam,1,Product gives out a lot of steam but it isn't consistent. Even on a low setting it will suddenly do 
 Best low cost steamer,5,"I’ve used several cheap no brand steamers, this cost about the same but is so much better. Produces "
 WAS working well until..,1,Out of the sudden it stopped producing steam! I cleaned twice and always make sure of adding clear w
 Steamer,5,Great steamer
" Simple, Affective",5,"Really great wanted one for a while now, the brush accessory doesn’t stay on very well but all in al"
 Works well but arrived damaged,4,Perfect for 2 or 3 people. Bought to use while we are having a new kitchen fitted. So far I have mad
 Well worth it,5,Perfect for my requirments
 Bottom fell out of pot,1,Crap quality I’ve just had to clear a curry up off the kitchen side as the bottom fell out of the ce
 Crackpot,5,Excellent
 Easy to clean,5,It works very well as expected no snags.
 great for 1/2 people,5,brilliant little slow cooker for 1/2 people or smaller batch cooking. it is easy to use and clean an
" Love this thing, perfect size!",5,"I love this slow cooker, I live alone and it’s the perfect size just for me. This makes 2 big portio"
 Winter stews coming up,5,Perfect for 2 maybe 3. Made casserole n dumplings will be making plenty for winter. Great slow cooke
 Easy to use. Perfect for 1/2 people. Very light,5,No dislikes . Cute looking anc easily stored away.
 Brilliant,5,Brilliant for soup or stew
 Nice game,5,Nice game
 worse than wii,1,souless
 Purchased as a gift,5,Great gameGood priceSpeedy deliveryLoved it.🎾⚽️🎳
 Fraud,1,This is a fraud product. It came without any codes or card inside. Contacted the customer support te
 Fun games mix,5,"As pensioners looking for winter entertainment this is great! Variety of games, lone or multi player"
 Great set of games,5,Very entertaining for all age groups.Simultaneous bowling for multiple local players is a good addit
 OK but overpriced,3,"The Nintendo Switch Sports game bundle includes fewer games than Nintendo Wii Sports, which I find t"
 Present,5,Great gift for my granddaughters 12th Birthday.
 Great Game,5,Me & my little boy love this game as it has got a variety of sports you can participate in
 Amazing,5,My boy loves it
 Excellent quality,5,"The physical book is so much cheaper than the digital version, how is that right? The quality is gre"
 Item left of doorstep,2,"Product itself is great, poor delivery service just dumped on my doorstep in a row of terrace houses"
 Lovely condition,5,This is a fun extension to the monster guide in the basic DnD packs. The collector of the title is a
 A complete disaster,1,My Autistic Son bought this book delivered today page missing torn out and a lot of the pages are st
 Essential resource for the DM,5,"Bought as a present ""to order"".Absolutely appreciated and well used.Easy to call it good value for m"
 Incredibly detailed,5,Plenty of new features and details
 Nice,5,"Good book, plenty of interesting things for players and DM's. For once delivered with no damage and "
 Damanged,2,Arrived damaged at the corners
 Great book,5,A really useful book full of info
" Get it, you know it's helpful",4,"Seriously, try to get all the books, the ideas scattered around in them will have you feeling like a"
 Great gift,5,Bought as a gift really good quality
 A perfect Gift,5,I gave this as a birthday gift and it was perfect. Good quality and sits well on car keys. tis taken
 Superb little key chain,5,Good ket chain if you like funkopops or atar qars
 Good for the price,3,well seeing the price I didn't have my hopes to high on the quality of this keychain but when it arr
 It's Grogu,5,Fantastic because it's grogu!! It came boxed so I decided to keep it on display in the box rather th
 What a lovely little character,5,I am a fan of Grogu and I was happy to find this lovely little key ring. Quality is excellent.
 So cute- but eyes are bit pink,5,"Super cute keyring, the guy I’m dating loved it. My only hesitation was he looks like he’s kind of g"
 Perfect,5,All good
 Love it!,5,I love it.
 Keyring,5,Bought this as a birthday present for my son and he loves it
 Excellent globe,5,I was surprised how much this leapfrog globe has to offer out of the box.It offers plenty to do if y
 Leapfrog rubbish,1,We bought this a while ago but only used this a couple of times the pen broke and I contacted leapfr
 Great Learning Tool,5,My 6yo daughter loves it and has been super helpful in developing her interest in geography
 Granddaughter loved it,4,Great learning aid for kids
 Wonderful education tool,5,I bought the interactive globe for my granddaughter's 6th birthday. She was thrilled with it and in 
 Good but restricted,3,Good fun for a few weeks but you need a pc to download the extra packs. It plays the games over and 
 Stylus pen stopped working,1,It was Santa's present... The stylus brake after two months of use. These are my 7 years son's words
" My kid love it, and I learn too",5,"OMG, this is so educational and fun at the same time. There are lot of small video clips to educate "
 Disappointing,1,The globe was bought as a Christmas present for our Granddaughter.Worked well for5 days and then sou
 Purchase as an Xmas present,3,Good product very educational but was quite expensive for waht it was and my kids lost interest afte
 Brilliant buds,5,These were a present for my husband who is difficult to please and he absolutely loves them. They fi
 Almost worth every penny,5,"The AirPod Pro 2 is a significant upgrade. These earbuds offer remarkable sound quality, fantastic n"
 Best in class!,5,"These are singlehandedly the best earbuds I’ve ever tried! The sound is very good, noise cancelling "
 Pinnacle,5,"Very good in all aspects, good wide sound, instantaneous connection, good battery life, amazing nois"
 Fantastic as expected,5,Had the AirPod 2 for two years till they started dying in a few minutes. Figured I’d upgrade to the 
 Excellent sound quality and NC,5,This is not a cheap product but the sound quality is excellent as is the noise cancellation. The tra
 Noise cancelling is very weak,2,Sound quality is very good. Comfort is good but not as good as previous generation AirPods Pro becau
 My first Airpods,5,Never had an Airpods before and I think this is what's every iPhone holder need as necessary accesso
 Awful Microphone!!,1,I gave this product a one-star rating due to its disappointing microphone performance. It's quite su
 These were a game changer for flying!,5,Excellent noise cancellation feature; this was a game changer for my husband whilst he was flying as
 Almost a year later going stribg,5,This is a great example of actually getting what you pay for.Heats up really quick and cooks food we
 Excellent,5,It's really easy to clean. I'm finding that I don't have to oil the plates for cooking.
 It cooks as it says,5,It is much easier to use than bothering with our big grill
 mini grill,5,"good little grill ,stores away neatly."
 Excellent,5,The best I ever had so far.
 Good value,5,Compact and well made. Perfect for one person
 Very Dissapointed,3,At the moment I have only used it for cooking sausages. Whilst they may be cooked throughout they lo
 Not a toastie machine!,1,Toasties to me mean sealed edges.This machine toasts the top and bottom of the bread and that's it.D
 2nd hand,1,
 Foreman,1,"Hard working cleaning it,quite heavy aswell."
 Tile Tracker,5,Excellent tracking device - bought the model that has replaceable batteries rather than the 3 year n
 Ideal for tracking luggage,4,Tried out for the first time during recent trip to/from Mallorca to keep an eye on the movement of o
 Disappointed - you have to pay for what should be basic features.,1,“Smart Alerts” should be included in the basic option.The whole point is to get a warning if you lea
 Either faulty or poor quality,1,"Having used tiles to locate my phone, keys and wallet in the past I decided to get some new ones aft"
 Absolutely rubbish and inaccurate,1,I bought these for peace of mind to pop in my daughter's pocket whilst she plays outside with her fr
 Waste of money,1,The tile pro does not have a range of 120m... It has a notify when found. Does not allow you call it
 Ok,3,"Not a bad bit of kit, quite accurate. I've used these to secure site keys. It can be used without a "
" Terrible, can't understand how these have good reviews!!",1,Terrible....i bought two of these to track my luggage and they only work when within about 30 feet o
 Excellent product,5,"Bought these after trying the Apple air tag, which I could hardly hear even standing next to it. Thi"
 Waste of money,1,I purchased a pack of 2 so that I could track my luggage when we went on holiday. Long story short t
 Hours of Play,5,"Great for any surface, just what my grandsons needed this summer! An absolute hoot playing round Rob"
 A swinging success,5,Swing ball set is great to use outside and inside depending on the weather .It’s great for all ages 
 Boy loves this.,5,"Good price, good quality and a must have for the garden. Packs away nicely for the beach too"
 Hours of fun and exercise,5,Love whacking the ball round with friends and family. Great fun. Makes us laugh a lot! Great exercis
 Great game,4,I was a bit worried as there was no cardboard cover showing the product. Contents look in tact but j
 Great,5,"Easy assembly , bit of fun for the kids in summer holidays ."
 Great,5,"Easy to set up, great quality and kids love it. Highly recommended."
 great product,5,this is easy to assemble and to take down and put away. We have had lots of fun in the back garden. 
 No outer wrapper,3,No outer wrapping or instructions like the picture shows. Bought as a gift but looks cheap in appear
 Go with the swing,5,"Easy to assemble great fun to use, good product."
 Great scrub,5,Works well
 Sooo good,5,This lip scrub is amazing love it so much
 Super soft lips!,5,Bought this after getting aligners and finding that my lips were getting really dry and flaky. It ha
 Scrubs my lips,4,Works as intended. Maybe make it taste a little worse cos i fell into a trance and ate like half of 
 really helps with drier lips,5,"very good, and edible too !"
 Amazing,5,Fantastic product. Got my lips feeling soft and looking pinker!
 NEW HOLY GRAIL,5,This leaves your lips feeling soft and beautiful honestly! 10/10 recommend. I use roughly 3 times a 
 Worst,1,Just fragrance and rest whole pot is drying substance
 Absolutely great,5,These work really well
 Loved it,5,"It smells amazing, a bit is guaranteed to go inside of your mouth so it's good that it tastes nice t"
 Great little pan,4,"Good little pan, non stick works well."
 Omelette pan 101% satisfaction with my purchase,5,101% satisfied with omelette pan.
" Ok, does the job",3,Feels cheap but does the job it's supposed to do. Smaller than expected.
 egg poacher,5,its brill ask for nothing better
 Dissatisfied,1,Hole in one of the egg poachers have to return it
 Eggselent,4,Good value for money 2 in 1 small non stick frying pan + egg poacher
 Too small,1,"Depth for the water is too shallow, and my large eggs wouldn’t fit in the cups."
 Handy pan,5,.
" Perfect eggs,",5,"Does what it says on the box, sturdy and easy to clean"
 Great little poucher,5,Very neat egg poucher cooks eggs really well as lid is heavy
 Sparkling water,4,"Save the planet, stop buying bottles of fizzy water, Check ✅"
 Good quality,5,Great product and excellent quality
 Saving £££££'s on plastic,5,Had a sodastream back in the 80's as kidsNow I'm saving money not buying sparkly water in litre bott
 Saves a fortune,5,Well made product. Can carbonate to the strength you like ans saves a fortune on buying carbonated d
 Good product,5,I recommend to everyone
 Overflows - does not work,1,My old Sodastream stopped working even with new bottles and this new unit is no different. Does not 
 Performance Inadequate,1,Carbonation did not last and gas cylinder only made for around half that’s stated bottles.
 Okay,4,The machine is exactly like my parents had when I was a child and soda stream was a new thing out al
 great,5,"Use it every day, very good"
 Soda stream,5,Does exactly what I want and saves me carrying pop into house
 Beautiful Frozen jigsaw,5,This was bought as a gift. The box is good quality and the four jigsaws are graded in size. The chil
 Puzzle,5,Good little puzzle for the price
 Very strong,5,My granddaughter loves them
 Stickers,3,Jigsaw was delivered with stickers all over the front picture. Unable to remove all of it which is r
 Birthday gift,5,I bought this for a children's party gift. I was very impressed that I was able to get a branded gif
 Brought as a present,5,"Daughter's friend loves frozen. Came quick, great packaging and she liked the gift."
 i managed to do it,5,"i spent like 4 weeks how to open the box and i hope ill finish it until winter""joke"" :)"
 Good value,4,"For £5, you can’t complain! The pieces are good quality and who doesn’t love Frozen?However, my feed"
 Don’t expect a huge puzzle,1,Bought loads of little items for friends as gifts. Tiny. Awful quality. Can get cheaper at smyths
 Nice puzzle but not easily separated,4,"Puzzle was great for my 3 year old but the puzzles are all in one box: however, can be differentiate"
 Great item,5,Used once and they were excellent. Very happy
 Pair of Callaway golf gloves,5,1st time I’ve used a pair of golf gloves when playing golf. Played in the rain so anyone who has don
 Very nice and warm,5,My uncle is very happy with these good quality and warm
 Great,5,Good present
 Feel good,4,Not used as yet but quality is good
 Kept me warm,5,I’m usually a fair weather golfer but have been playing a few rounds in the cold & wet. They kept my
 Winter golf,4,Great for keeping the hands warm but only a 4star as they do take on a fair bit of water when it rai
" Wear very quickly, lovely glove but the quality could be better",3,Quality needs improvement as they wear very quickly
 Great gloves,5,Great quality gloves that last
 Perfect fit,5,Second pair purchased absolutely fabulous
 Great kitchen addition,5,I love this. All the compartments work great. The chopper function is particular good. Very good cap
 Good Food Processor,5,"Only a small negative, is it a bit loud when using the blender"
 Worth it,5,"Complete process food, blend soup and smoothie with small blender.I love it."
 Great Kitchen Gadget,4,"I absolutely love this! from mixing, juicing and blending - superb performance. A little on the loud"
 Nice,5,I love it
 Brilliant appliance.,5,This is built to perform. Its scarily efficient. I am still learning to use all the features. I do r
 Can’t blend everything,1,It’s okay. Bit pricy for what it can do. The pure function is useless. If you want something blended
 Excellent product,5,"Sturdiness, powerful"
 Bowl broke and no replacement,1,The bowl sheared off at the screws after just one year’s use and there is no available replacements.
 versitile,5,versatile
 Mixed feelings,4,It toasts well.It has only 2 slots as against my old Tefal with 4.The slots are not individually pro
 Toaster,5,Good price works ok looks good
 Is what it is,4,Bought for my friend because i broke her toaster.Takes a while to get used to the shape.Makes good t
 Cooks uneven and burns crusts,2,Been using this a couple of months now and have to manually turn the bread halfway through to get an
 Good toaster,5,Excellent service
 not 4 slice at all,2,dont waste money doesnt fit 4 slices no matter what way rotated doesn't toast properly
 Didn't even last 3 months,1,"The toaster started sparking, while making some toast, cancel button stopped working, it would have "
" Ok, should be a little deeper",3,"This could do with being a bit deeper. It’s useful having lots of width though, why more toasters ar"
" Looks the part, but can't do the job!",1,"OK - the good points - it looks good, is cheap, and the controls are on the front.However, it just d"
 Great buy,5,Very good buy
 J Wales October 2023,3,Bought for Christmas gift pleased with purchase
 Great product for teaching new words,5,Highly recommend
 Best Baby Book Iv Found,5,Excellent noise and sounds our Grandson of 12 months loves the LeapFrog books. 5 star.
 Well made,5,"Nice toy, entertains and can stand being thrown across the room lol"
 Great,5,Very enjoyable my grandson loves it
 The kid enjoys the giftWhy to share to video,5,Gift for 2 yr old Boy
 Great,4,Love this just what we wanted good value for money
 Poor,1,Very poor quality. Sound didn’t work properly Returned the product.
 Great gift,5,Bought this as a gift many times and recommend to anyone with young children
 Harry birthday toy,5,Fantastic absoutley loved it made his day
" Good device, strap causes rash",4,I upgraded to the Charge 5 from the Charge 2. Definitely an improvement and does everything I want i
 Being returned in less than 24 hours. Amazing customer servive,2,"So disapointed. The watch wont sync, wont reset, its been a very frustrating time. Fitbitt support c"
 Upset,1,I bought it in May.... it has stopped working in October 😡☹️....
 Avoid,1,Functions failing and totally dead in less than 10 months. Not worth the cost.
" Device itself is excellent, but strap keeps coming off",1,"The FitBit Charge 5 itself is excellent. It automatically detects most activities, so it will track "
 Stopped working in 1 year,3,"I've bought this for my mom. She used it very gently, but it stopped working 1 year after purchase."
 Unreliable,1,This has become a truly terrible product. The app isn’t user friendly and it’s now a mission to try 
 Great when it works but too short a life,2,Bought to replace a Charge 3 that died after about 4 years. It's lost the floors count but compensat
 Rash with strap after a few weeks,3,This is my second Fitbit. 1st one I got off my daughter when she developed a rash with the silicone 
 Fits perfectly,5,"I love my Fitbit! It comes with free Fitbit premium for the first 6 months, which has really helped "
 Nice scent and quite good value.,4,We like this one and would buy it again.
 Good to use,5,Good to use in a bath and produces bubbles
 Gorgeous,5,Fab product and better price
 Luxury bubbles - No residue - Very concentrated,5,I absolutely love this Lavender-scented Bubble Bath! It's the ultimate treat for a luxurious bath ti
 Foams well and has a great scent,5,"Really good bath foam, as one would expect from Neal's Yard; it foams well, and has a great scent. F"
 Smells great,3,Love the smell . Fills the whole bathroom room with lovley smell .Really liked this .bit expensive f
 Expensive on the larger size,5,"Great product and love having it in the bath before going to bed but I got the bigger one,.Some migh"
 Great product,5,Great product but at a high end price point
 Delighted,5,What's not to love?!
 Luxuriant beauty sleep foaming bath mix,4,Neil’s Yard Remedies is a brand I’ve used in the past and I’ve never been disappointed yet. This bea
 Excellent quality,5,"The physical book is so much cheaper than the digital version, how is that right? The quality is gre"
 Item left of doorstep,2,"Product itself is great, poor delivery service just dumped on my doorstep in a row of terrace houses"
 Lovely condition,5,This is a fun extension to the monster guide in the basic DnD packs. The collector of the title is a
 A complete disaster,1,My Autistic Son bought this book delivered today page missing torn out and a lot of the pages are st
 Essential resource for the DM,5,"Bought as a present ""to order"".Absolutely appreciated and well used.Easy to call it good value for m"
 Incredibly detailed,5,Plenty of new features and details
 Nice,5,"Good book, plenty of interesting things for players and DM's. For once delivered with no damage and "
 Damanged,2,Arrived damaged at the corners
 Great book,5,A really useful book full of info
" Get it, you know it's helpful",4,"Seriously, try to get all the books, the ideas scattered around in them will have you feeling like a"
 good value,5,greatgrandson loves it
 Brilliant,5,"Great value, perfect for little hands, easy to assemble and nice bright colours. My 18 month old gra"
 Excellent Toy,5,Excellent Toy
 Perfect,5,"My granddaughter loves this set of duplo, we are adding to our collection slowly. Lovely bright colo"
 We love Lego,5,"Our little boy is in Fireman season, so all have to be about Firemen...."
 Lego toy,5,Usual good quality. Bought as a gift for great nephew who loved it.
 Fun fire engine,5,My fire-engine mad daughter loves this toy! Was simple enough for her to build by herself yet kept h
 Child loves this,5,Lovely Duplo set. The child I gave it to likes the story element to it... it's not just building blo
 OK,4,OK
 Well received gift,5,Ideal for 3 year oldLoved it
 Great Addition to JBL Range,5,I have the JBL Charge 5 for home use and longer travel but recently bought the JBL Clip 4 for short 
 Good,5,Best product
 Good,5,Good
 Great and good value,5,Sound is amazing - especially the bass. Amazing value and a great product.
" Sounds great, but doesn't last as long as I'd hoped",4,"Great sounding bluetooth speaker, with handy clip to clip onto belt loops when working. Has enough v"
 Travel speaker,5,Very good band of speaker. My friend has one that's why I brought it. I took it to Jamaica and it pl
 Excellent sound quality,5,It was bought as a gift for my granddaughter and was well received. The overall quality of the produ
 Nice 👍🏾,5,
 Great little reasonably priced speaker.,5,"Took this speaker on holiday for around the pool and evenings. It was great, with well balance clear"
 Great value brilliant sound.,5,Handy size to travel around with connectivity excellent performance all you could ask for highly rec
 Happy with this mixer,5,"Ideal for a small kitchen, good little mixer, does what I need it for"
 Sturdy & stylish,5,"Very pleased with this food mixer. It's sturdy, looks nice, and does the job."
 Value for money!,5,Absolutely love this piece of equipment for my kitchen. It works well and I managed to bake a lovely
 Flaky,2,Using the stand is pretty useless so I've used it mainly as hand held and the problem with it is tha
 Do not buy,1,It broke as soon as I started using it. It lasted a few minutes and then it was completely dead. It 
 Great little machine if you are on a budget,5,"This is great little machine if you are on a budget, cheap and cheerful. I have used it several time"
 Recommend,4,"Nice to one gadget, does the job looks quality"
 Disappointed I'm afraid,3,"Price was good, a good size. Unfortunately I was disappointed, The beaters keep falling out , and no"
 Do not buy,1,It’s rubbish and does not mix properly. I would not recommend it.
