Title,Rating,Comment
 M Power,5,These little MacBooks are ideal for students and small office. Mature to buy Apple Care as they are 
" Love my laptop, slight issue with screen sometimes...",5,"Love this laptop so much, that I am currently typing from. However, sometimes the screen does a weir"
 It’s very lightweight,5,.
 MacBook Air M1,5,"Absolute beauty, thanks Amazon!"
 MacBook,4,This is a really good opportunity to buy this MacBook. And I like it! Also its come brand new.
 Faulty,2,"I brought it in 2021 and the screen went in the first year, it was fixed free, because i had only ha"
 Outstanding Machine,5,"I bought the M1 Macbook Air base model in 2021, I was looking for a fanless efficient portable compu"
 M1 air which looked no different to my airbook air I purchased in 2012 :-),1,M1 is ok if you don't ever intend to play games and just want to use a laptop for office based tasks
 Quality on point,5,Best buy ever
 Beautiful,5,Never seen something more beautiful and amazing then this thing in my whole entire life. The only th
 Very little to criticise. Almost five star. Magic stabiliser.,4,"-I didn't buy my G9 through Amazon-I'm a fan of Panasonic cameras. I've had a few other makes, but c"
 Such an epic camera,5,The G9 has been a revelation. I bought it as a cheaper way into birding photography. Used with the P
 Excellent camera,5,Bought this as a second camera to go alongside my GH5 but I find this is so good for stills it's bec
 I love it so much,5,It’s probably not healthy to love a device as much as I love this camera right now! I have owned a h
" feature packed camera, beautifully engineered, huge variety of compatible lenses",5,"This is my 4th Micro4/3rds camera (GF5 (backup body), G5 (now my daughter's), G6 (now surplus)) in q"
 .,5,"Great product, having used Panasonic previously I found the upgrade easier than I thought.Overall go"
 My 2nd G9,5,I have been using lumix cameras for a long time and love them. I had one G9 but more than one lens s
 Great Camera,5,Bought this as the other models on the market now are more aimed at V-Blogging and I wanted somethin
 Nice camera to start doing more videos without investing too much,5,Got this after checking different options. Love the easy buttons to use and the menu is very friendl
 Best camera I have used,5,Forget its ability to let you set several instant personal program modes. Forget the easily to use l
 Trusted product,5,"Great product, it's my second purchase of the same item and it's perfect."
 Not much difference from previous versions,5,Does th job for streaming
 Cheap rubbish,1,Remote didn’t work out of the box. Absolute waste of time and money.
 Fire stick,5,This is a vast improvement on my old one half the time Disney plus wouldn’t work on it it’s easily v
 Fire thing,5,Yep
 DOORBELL,5,EXCELLENT PRODUCT
 Nice,5,Very happy with it.
 Excellent product,5,Purchase some months ago value of money ideally suited
 Great price and quality,5,Very good all round
 Nice,5,Remote is very easy to use
 Left my dishes with white powderly traces,2,We are trying different dishing washing capsules to see which one works the best with our new dishwa
 A little Expensive,3,"A little Expensive , not worth the expense when purchased at full price."
 An improvement on the original tablets,5,In my opinion these are a improvement on the tablets which we have used for years. Gets the crockery
 Clean Dishes.,4,I seem to get better results at higher temperature wash.
 Value for money,5,"Bought them on prime deals. Does the job very well, happy with my purchase"
 Best,5,The best
 Great value,5,"Great value for money,Cleans my dishes perfectly."
 Excellent,5,Good product
 Clean machine,5,These dishwasher tabs are amazing they don't just clean your dishes the inside of the dishwasher loo
 Perfect,5,Excellent
 Cheap is as cheap does.,2,This paper is the worst I've ever used as it's too thin. You can buy better quality from high street
 Perfect,5,Great value for money
 Toilet tissue,5,A bargain I have purchased more than once.
 Nice softness,5,My daughter will now only buy this toilet paper.
 Quality,5,"The service was brilliant when buying the product, the quality is good"
 You get what you pay for,3,These are a lot thinner & smaller rolls than another leading brands 3 ply quilted rolls
 Good quality,5,Very good quality. Will be ordering again soon
 Reasonable price,5,Quality and value for money
 Not as thick as they used to be,4,"Bought on special offer price so not too bad, the roll has shrunk in size , not like they used to be"
 Cleaning my bottom,5,"This product does what it’s supposed to do it’s great for cleaning the poo from your bottom, it does"
 Good value and price -- thanks.,5,Good value and price -- thanks.
 Just works for us!,5,"Been taking vit D for the lads few years, only take it during end of September to April, covers the "
 Good product,5,Arrive day after ordering and a good price
 Vitamins for B12,5,These are great to take through the winter months
 Delivery time👌,5,Perfect Masks 👍
 Essential for a more mature woman,5,For anyone going through the menopause I would certainly recommend a daily dose.
 Good!,5,Good value for money and easy to swallow.
 Exellent as always,5,"Been recommended by doctor to use it every day so here we are, buying these constantly"
 Nicely packaged,5,Ease of swallowing and good value for money ( I think!?) if it does do the expected job over a perio
 Vitamin D,5,"Used it in previous years. Small, easy to swallow."
 Great product but delivery was left on doorstep not as instructed,5,great product in volume 14 pence per wash
 Favourite,5,My favourite family detergent at a great price.
 All in one,5,clothes smell lovely clean and soft and gets rid of most stains all in one pod
 Ok product,3,Expecting more from this brand
 oh yes Clean and good value,5,I have this product on subscribe and save. It is absolutely brilliant. I can get 10 pods for five po
" Tried everything, but always come back to Ariel",5,"I have used a lot of pods, powders from Amazon, virtually every make, they are nice, but nothing I h"
 easy to use and economical,5,give fresh perfume to clothes
 Confused. Pod,1,I was expecting 64 pods per pack an not 54. Disappointed.
 Value for money,5,"I think is a good way to save, as i have been using for long time and more useful"
 Good value for money,5,I normally buy these from Iceland before finding these and realising they save me more money over th
 Replacement,5,"Excellent, very pleased with purchase. Quality/sound no problems. Well worth the purchase. Thank you"
 All round a good buy.,4,Simple to install and use. Plenty on offer to watch though a lot of old stuff. All in all a good buy
 Perfect,5,I didnt buy one of these for ages... wish I had. Easy to install basically does it all for you. Easy
 Useless product,1,Thought I could swap between inputs with that but no. Still don't understand what's this for. I wasn
 Good,5,Very happy
 Faulty,1,Tried to set it up but the remote connection to the log in page wouldn’t connect.Had to ring Amazon.
 Ease of use,4,Turned up on time and works. All good.
 easy to use,5,perfect
 perfect,5,Had an older smart TV that wouldn't update. Bought this and can now use the old TV again
 Upgraded remote,5,"Fire stick is great, access to all the major apps in the UK, easy to plug in and set-up. The remote "
 Keeps jamming,1,Keeps jamming the copier when previous paper went through fine.
 good product,5,I have been using these copy printer papers for a while now and I have consistently been impressed w
 Don't Buy this Product,1,The paper constantly jams in the printer causing delays and frustration when printing. I doubt it is
 Only good for lighting fires,1,"Poor paper keeps jamming in printer, a waste of money. Wasted too much time printing again and again"
 Not great in the paper handler,3,Bought this as a replacement for my usual HP 80GSM paper. Doesn't handle very well in printer feeder
 Good Quality Paper,5,Happy with the quality of the paper - used for usual bits and pieces of home printing.And the usual 
 excellent value for money,5,"I recently purchased the Amazon Basics Multi-purpose Copy Printer Paper, A4 80 gsm, 2500 Count (Pack"
 Good value,4,It's good enough. It compares well with other cheaper paper. Better quality than most 'cheaper versi
 Great,5,Good paper for the price. Arrived quickly too.
 Arrived like this !!!!,1,Disgusted I can't even use this !! Soaked through!
 Waiting for replacement,1,Part missing and told a new one would be replaced but still not had it
 Tiddly,5,"Listen, if you have shovels for hands Don't even consider this one.It's small, like really small, bu"
 Superb Value,5,Just received this to replace my Logitech MX Anywhere 2S Wireless Mouse which doesn't scroll properl
" Great mouse, but not as long-lasting as I had hoped.",2,"A good, compact mouse, with an easy feel and an authentic “click” action which can still be felt. Th"
 This is one of the computer mice of all time,3,"It's pretty small and basic so I wouldn't use it for anything except working while away from home, w"
 Everything I needed,5,I loved this product. Usually I don't use mouse I am used to the touch pad but I can't deny it helps
 Not great,1,Didn’t work anymore after 3 month - I bought 2 both uselessEven that I didn’t use them often
" Works well easy to use,",5,"Nice size to handle works very well, Worth the money, Recommended"
 Perfect travel mouse.,5,"Whether taken on the road or used in the office, the quick and ease of use for this mouse is perfect"
 Just what I wanted,5,I didn't dislike anything
 great,5,great
 Cat food,5,Cats loved it and bonus price at the time
 A fussy cat approves.,5,My cat suddenly got very fussy with her food and was leaving the ones she used to like so I tried th
 Cat,5,My cat loves these and they are good value for money
 Price,5,Feed the 🐈
 Perfect,5,Perfect just what we need. Arrived in good order and in good time.
 Well the cats & foxes I feed love it all puuuuuurfect. Many thanks,5,Nothing to dislike or find fault with. So well pleased with my goods... .
 Easy to serve,5,Cat seemed to enjoy it
 Cats like it,5,"Cats like it, so must be good"
 Clean bowl,5,"My cat ate the lot l, loved it. Will definitely be buying again"
 Strong bags,5,"Great little purchase. Strong bags, nicely perfumed."
 Not compostable,1,Hard to separate bags.Unpleasant smell and definitely not compostable. Will not buy again.
 Recommend for baby,5,These are great mini rolls to keep nice and neat and travel with. So compact and great size. Only th
 Great item,5,Strong bags
 Nice Smell .,5,Bags eliminate smell of dog waste very well .
" Sturdy, easy to use",5,"I know, poo bags, what can you say? Well, turns out they're not all equal. One batch of cheap ones I"
" Yup, they hold poo...",5,"In all seriousness, they actually do."
" Robust bags, great",5,These are much better than the flimsy bags we got from the supermarket which often ripped which is o
 Poo bags are Awesome,5,These are great and fits in pockets and cars we never run out
 Too thin!,1,I will leave it to your imagination! Won't buy again 🤢
" Good strings, does the job, perhaps not slinky for long",3,"They have a very nice slinky sound when they come fresh, excelent sound, after a fast while i think "
 Only part of order recieved,1,Only received one set I ordered three sets and payed for three sets please send two more sets or ref
 Good price,5,All ok
 Great I’m between gauge,5,Awesome for keeping the guitar in tune (especially strats) and great tone for rhythm and easy on the
 Good strings but...,3,"I usually go for 10's, on rare occasions 9.5's. I've bought this pack as I needed to change strings "
 Guitar strings,5,Efficient & quick can I have some more please
 A great improvement....,5,"I am by no means a guitarist and can only play parts of my favorite songs and themes, and I find mys"
 Quality strings,5,"Always use these strings, they have always been the best quality"
 great,4,was really good
 Ernie ball Slinkys rule,5,My favourite strings after many years of playing
 Arrived broken,3,"When I opened the package, something was rattling in the machine, I took off the lid and the piece w"
 Disco Disco Disco,4,Very good. Easy to use
 Blew up,1,Product blew up and sparked from the plug. Could of caused a fire. Really unhappy.
 Light,5,It is nice.
 Good value for price,5,"Excellent item for the price & colours are lovely & bright & choice of settings. Only tested item, b"
 The motor stopped working,1,The lights are good but the spinning stopped
 How can I play music,4,How can I play music? Bluetooth settings on phone show no device
 Perfect for kids,5,My baby loves it for sensory input. My toddler puts it on with music to dance
 Arrived broken,2,"Product seems good for the price. But unfortunately arrived broken, resulting in a very disappointed"
 Great value,4,"I bought this item for our trip to Amsterdam. The lights are bright, covered an entire room, it also"
 Wish I bought it sooner,4,Such good value and game changer wish I bought it years ago.. only improvement could be that it coul
 stopped working after 1 winter!,3,im really upset! i bought it last winter and it kept me so warm in the night. now that im ready to u
 Electric under blanket,5,Easy to secure to the bed dual controls heats up quickly
 pleasant,4,not as hot as I expected but perfectly adequate
 Cosy,5,This was bought for my elderly mother and she loves the comfort and quality.
 Excellent dual control underblanket at a good price and a reliable manufacturer.,5,I like that I can control the temperature on either side of the bed as one heat doesn’t fit all.
 Not impressed,2,I have bought a double one for my bedroom and I am pretty happy with it . So I decided to get a sing
 Great when it actually works and is new,3,"When it works it is really nice, warms up the bed quickly and gets to a nice temperature. However th"
 Very simple easy to use.,5,"I start with number 3, it heats up very quickly, but it's very warm and that's why I leave it on num"
 Silentnight electric blanket,5,Excellent value for money and easy to use and install. Would recommend this product.
 Nice touch,5,Great to send to someone you missing..
 Perfect,5,As it said and looked
 Fast delivery,5,A great quirky gift.
 Check the sizes,1,"Nice little verse, size ridiculously small cheapy looking"
 Just fits nicely in my granddaughter's hand,4,"I liked the product, and my granddaughter was also pleased with it xx"
 Love them my gosh,5,"Just right , I thought a bit small but they are fantastic 😜"
 Gift,5,"Lovely gift, and from the photo I was sent it was beautiful and as it appears in the photo!"
 Beautifully crafted,5,Lovely neat gift just right for keeping on you. Good quiality
 Great gift,5,"Ordered for my son as a good luck for school. It was a great gift and fitted inside a card, he loved"
 Nice,5,Gave to my niece after she lost her mum
 Stopped working,1,Stopped working after a few weeks and GoPro customer service is the worst I have ever experienced. T
" Overheats, freezes, avoid gopro like a plague",1,"I was super excited to get my first gopro. Does it film with great quality and ease? Yes, but only w"
 Go pro 10,1,This camera have under full video record and the battery is the big down fall. Also overeating so qu
 Great camera but not if amazon sell you a faulty one,1,I bought a warehouse version at a discount and it doesn't work properly. It's not possible to turn i
 Great Produxt,5,"Excellent and was exactly what I wanted for general photos, selfies and underwater videos."
 Rubbish Batteries,3,"I have given this Gopro Hero 10, 3 stars mainly because the blue batteries that come with it are rub"
 You MUST buy a MicroSD card which is sold separately,5,"I've asked Amazon to add to the listing ""You must buy a MicroSD card which is sold separately"".Lucki"
 Worst Product,1,Battery life is very cheap. They buy a good amount and the battery of the camera won't last for one 
 The software is still absolute garbage,2,"I've owned a GoPro Hero 5 Session for a long time, and it worked pretty well as a basic helmet camer"
 Love this!,5,Fantastic bit of kit and got a great deal on mine which is even better! Much better user experience 
 Very absorbent,5,Good value as they are so thick and absorbent you don’t need as many sheets to mop upspillages.
 Value,4,Thickness uses less then other paper towels
 Best kitchen roll,5,"Very good absorption, enough one square not half of the roll."
 Cheaper than Asda,5,Always buy from Amazon as it is better value than supermarkets and don’t break and good for cleaning
 Quality has Reduced!,2,Been buying this for years with great quality and value. Unfortunately the latest order received the
 Super absorbable tissue,5,"Good value for money, good size and quality, very pleased with how absorbent the sheets are very use"
 The Package,4,Easy to order/ Quality product/ no handling at a supermarket / prompt delivery/ good bargain
 Quality has dropped and price gone up,2,"Had these on order over the last couple of years. Unfortunately, the price has gone up considerably "
 Best kitchen towel,5,"Best kitchen towel, big sheets, cleans up well. Strongly recommended."
 Great Product,5,"I have these on subscription. Really good size sheets, very absorbent."
 rescuepro deluxe not included?,3,"no registration key for rescuepro deluxe recovery, at least on card packaging"
 Great product watch out using buy now!,2,Ordered to use for a trip away as a long standing prime member and used buy now feature but it defau
" Massive size, good value.",5,Works well.
 Faulty card,1,"After copying files onto the SD card, only the first 60GB or so could be read. After this point the "
 Fast,5,Use it in a NextBase dashcam cos it’s cheaper than a NextBase branded one and I’ve had no trouble wi
 Excellent micro sd card,5,Sandisk extreme have good speeds but not the top speeds available with other brands and models. But 
 Speedy,5,Use this in my steam deck so far it has done everything required of it with no issues
 super service a problem was corrected very quickly many thanks.,5,used for storage on a motorola phone and is working properly .
 Ideal for my Drone Video and Photography,5,"Always used SanDisk SDXC cards for all my cameras for many years,and now Drone, Video and Photograph"
 Beaut,5,Great capacity and good value
 MacBook Air,5,Excellent product at a very reasonable price
" Fit's my lenovo ideapad 5 flex 14"" very well",4,"At first I was skeptical when ordering, if it was going to fit my 14"" laptop as I selected the 13.5"""
 The JETech Laptop Sleeve is a good fit for my laptop. It also protects by the JETech laptop sleeve.,5,The JETech Laptop Sleeve looks good.I am impressed by the protection by the JETech laptop sleeve.I h
 Perfect!,5,Really good size and very practical.
" Excellent, perfect fit for my surface pro",5,"Really well made with a lovely soft lining, a complete bargain"
 Same Amazon value and reliability,4,"The sleeve was received as pictured. The sleeve was delivered 3 days later than advised. However, I "
 13 in laptop case,5,"Product is exactly as described, a nice colour and lovely soft material inside. It appears very good"
 Nice case,5,Lovely soft case which holds and protects my MacBook Air very well. Has an external zip on the outsi
 ❤️❤️❤️,5,excellent ❤️❤️
 Looked to be of good qualty.,5,the JeTech laptop sleeve for 13.3-Inch MacBook Air/Pro looked to be of good quality. It was for my d
 Every guitar/bass player should have those in their guitar case,5,Every player should have this in their guitar case. Would recommend
 Guitarpolish,5,"Handy bit of kit, only use every so often does a good job."
 Makes the fretboard look fresh and well care for,5,Easy to apply and price seems fair
 No delivery 15 days no refund,1,Ordered on 30th of August cancelled by supplier now 15th September and still no refund. Amazon Custo
 Does what it says,5,Great to keep your guitar in good condition
 Excellent,5,Excellent
 Works a charm,4,Great on old dusty frett boards
 Amazing,5,Restored my fretboard on a 50yr old Spanish acoustic
 Expensive but worthwhile for maintaining fretboard,5,Does the job.
 Great Finish,5,"Removed all smudges from the fret board, not sure on the flavour though... smells nice aha"
 Delivered on time,5,Very good for plucking guitar strings.
 good wuality,5,brought them in december and still have all til this day (oct 1 2023)does come in all sizes
 Just what I needed,5,Good service and prompt delivery
 Good,5,Good quality product
 so much variety,5,these are very good i often switch between them very good
 Multi guitar picks,5,"Lovely looking,"
 A Perfect Melody of Variety and Quality - A Review of PPpanda Guitar Picks Set,5,"The PPpanda Guitar Picks set, consisting of 32 assorted plectrums, has proven to be an excellent add"
 Great,5,"Unlike most guitar picks these are strong, ive had some very weak picks in the past that bend wherea"
 Finger picking good.,5,Good choice of plectrums in the box.Acetate as well. Distinctive to look at.
 speedy deliver and amazing quality,5,the picks are a bit thing but i have so many im never running out they’re all fun colours and really
 Guitar string winder,5,Great little tool I change all my strings with this no problem.
 Useless for unwinding - head keeps coming off,1,"Works great when winding, but in the other direction, the screw holding the winding head unscrews it"
" A must have, period",5,Okay without this I would have been totally lost... I have replaced the strings for the very first t
" Not bad, prefer the older version",4,The older one was a bit bigger and the pin puller was on the winder. I have one that’s been used wee
 Great product,5,"Handy tool , makes changing strings easier."
 Essential tool for restringing,5,"All three parts you need, proper wire cutter, removal tool for the pegs, and a winder. I probably do"
 It does the job,3,It does the job but is no better than similar products available at a much lesser price.
 Like butter,5,Cuts string like butter. Even a 0.068 on a 7 string
 Exact product!,5,Just what I need!
 Buy one,5,Spent 30 years refusing to get one of these as I saw them as a gimmick. Always restrung by hand. Fin
 It’s a great cleansing balm,5,It’s great on the skin
 Smells gorgeous,5,Feels like a little bit of luxury.
 Jan,5,I love this product best ever.
 Favorite product now (first time),5,I am in search to create the best skin care routine for myself.I have struggled as I have sensitive 
 It’s nice,3,Quite a strong scent. Works well. I feel like I use quite a lot
 Wish I had read reviews,1,"Arrived looking slightly different to my usual Elemis products. No box, no seal. Also just smells sl"
 Luxury in a jar,4,"A spa in a jar, one of the best cleansing products I’ve ever used, a little goes a long way so the j"
 Smells amazing,5,"This just smells amazing, smells very spa like. Great texture and just melts the makeup away. A litt"
 Feels and smells great!,5,"Highly recommend this product. Makes your skin feel luxurious, cleansed and radiant."
 Excellent,5,It feels great on the skin. Smells lovely too. I sometimes leave it on for a bit before washing off.
 Works well but arrived damaged,4,Perfect for 2 or 3 people. Bought to use while we are having a new kitchen fitted. So far I have mad
 Well worth it,5,Perfect for my requirments
 Bottom fell out of pot,1,Crap quality I’ve just had to clear a curry up off the kitchen side as the bottom fell out of the ce
 Crackpot,5,Excellent
 Easy to clean,5,It works very well as expected no snags.
 great for 1/2 people,5,brilliant little slow cooker for 1/2 people or smaller batch cooking. it is easy to use and clean an
" Love this thing, perfect size!",5,"I love this slow cooker, I live alone and it’s the perfect size just for me. This makes 2 big portio"
 Winter stews coming up,5,Perfect for 2 maybe 3. Made casserole n dumplings will be making plenty for winter. Great slow cooke
 Easy to use. Perfect for 1/2 people. Very light,5,No dislikes . Cute looking anc easily stored away.
 Brilliant,5,Brilliant for soup or stew
 Defective and used,1,The water tank of this item was wet so I wasn't at all surprised when it didn't work properly. Obvio
" Its Ok, Not Great.",4,"Really great wanted one for a while now, the brush accessory doesn’t stay on very well but all in al"
 not the best for curtains.,3,I really didn't want to iron the curtains so I gave it a go. Curtains are cotton but not thick/doubl
 Not even a year old & doesn't work,2,"For the price of it, I would expect to get more than 10 months out of it since its only used to iron"
 Great travel companion,5,Was really surprised by how good this little gadget is. I took it on holiday and did a great job at 
 Spits lots of water with the steam,1,Product gives out a lot of steam but it isn't consistent. Even on a low setting it will suddenly do 
 Best low cost steamer,5,"I’ve used several cheap no brand steamers, this cost about the same but is so much better. Produces "
 WAS working well until..,1,Out of the sudden it stopped producing steam! I cleaned twice and always make sure of adding clear w
 Steamer,5,Great steamer
" Simple, Affective",5,"Really great wanted one for a while now, the brush accessory doesn’t stay on very well but all in al"
 Well received gift.,5,"The little one apparently loves it, makes bathtime more fun."
 Falls off the wall,3,Stuck it to the wall but when you use the handle to pump the bubbles it just falls into the bath.
 Doesn't work,1,3 different bubble liquids and still no foam. Fell off bath tiles and hit my child (surprisingly hea
 Great toy!,5,"Does exactly what it says: stays stuck to the bath, creates lots of foam (if you put proper bubble b"
 Ice cream bath toy,1,It didn’t ever work. Should have sent back.
 Loved it,5,Perfect for children
