Title,Rating,Comment
 Faulty,2,First purchase broke within week received it so had replacement and that have broke now as well only
 Great,5,Granddaughter loves this
 Lol campervan,5,Excellent. Well made product. Quality materials used. Daughter will get lots of play out of this.
 nice gift,5,"quality plastic toy, lots of different elements and 5 yr old loves it"
 Great value for money,5,Great quality and a lot of fun for the price!
 Beautiful,5,Beautiful and excellent quality. My 6 year old daughter loves it.
 Good size,5,"Bought for granddaughter who loves it, good quality"
 Very nice,5,"I thought it will be much smaller, was very pleased when actually got it to find out its good size :"
" It’s LOL, the kids love it",5,"My little girl was delighted with this, she’s 5 and loves an LOL has the camper van and plane etc bu"
 This was a Christmas Gift,5,"As this was a gift, I do not know if this is has been used yet!!"
 Fun LOL camper.,5,Granddaughter loves this camper!!
 All good :),5,All God :)
 Benefit is benefit!,5,I tried many types of mascara and every time I return to this one because it’s my favourite.
 Everyone wants it,5,Literally never had so many people ask me what mascara I use! Its so light on the eye and looks so g
 Highly reccomend,5,Never use another mascara again. Great results
 Brilliant mascara,5,"Wouldn’t use anything else,eyelashes look like false ones ."
 Looks good but …,3,It’s pretty good but I have to use a dry mascara want after I apply this to separate the lashes. I f
 Great mascara but not boxed.,3,Disappointed that this mascara was not boxed despite the picture giving the impression it is. It als
 Nice mascara,5,Nice handbag size mascara good product
 ♥️♥️,5,♥️♥️amazing
 Great mini mascara,5,Really good for if you don’t wear mascara that often like myself. Best used after eyelash curlers as
 Highly recommend,5,Should've bought one of these years ago. I just let it do it's thing and I carry on with other house
 Brilliant product.,5,Bought on prime day as I have back issues so using conventional vacuum difficult. This little robot 
 Its handy,4,Its really good but no remote control. App isnt good. Not easy to use. But other than that its a god
" Great little guy, but need some guidance.",4,
 50% off,5,Simple to set up. Create a schedule and just forget about it. If not just switch it on and let it go
 Great purchase,5,Really happy with my purchase very quiet and does a great job. It has a long battery life and a grea
 Just press the button,5,Read all the complicated instructions on how to set up fell down on not having wi fi. Looked it up o
 A Game-Changer for Clean Floors!,5,I'm absolutely thrilled with my Lefant M210 Robot Vacuum Cleaner! It's been a game-changer in mainta
 Excellent,5,Great price and performance.! Is very quiet and surprisingly powerful. We have hardwood flooring and
" My second robot vacuum cleaner, wow",5,This is my replacement for the Trifo Emma Pet I’d had for circa 2.5 years which has sadly packed in 
 Easy fun game,5,This is a game of chance and no skill needed but is loved by my 3 year old grandson - it's his favou
 Great,5,Great for small children that are just getting in to board games. Although would be better if the co
 Cheap and fun,5,"An easy to play, colourful, entertaining children's game, for an affordable price. Very happy custom"
 Xmas present,5,Supwr bright and looks good
 Great seller,5,Great item
 Nice and easy game,5,Fun game for a unicorn lover.Teach colour and easy to use for young one.
 Lovely game but would be better if more picture tiles instead of the leaves,4,"Well-made and lovely drawings of the bugs. We enjoyed playing this game, however, it was confusing t"
 Fun memory game!,5,"Got recommended this from a friend and my little boy absolutely loves playing it! Educational, fun a"
 Great for kids,5,I bought these for my grandson and he loves them
 Loved by the receiver,5,Kids love it
 Library in your pocket!,4,"Having owned a keyboard version from around 2011, I have ""upgraded"" to the basic 2022 model.My origi"
 Easy to hold,5,Very easy to hold and to use. Just tap the screen left or right to flip back or forward. Screen is c
 Nice and small,4,"Easy told hold, clear screen and able to be read in the dark , my 2nd kindle and this is far lighter"
" Used to be great, now it's utter rubbish that you can't even turn off!!!",1,Hey Amazon when you made this why did you assume nobody would ever want to them off? What a stupid t
 Kindle Easy Reading,5,"Very light to hold. Great clarity of screen. Facility to enlarge text, lighten and darken screen. Lo"
 Love my new Kindle,5,So light and easy to use. Holds so many books. I can take it anywhere as it fits into my bag easily.
 Kindle,5,Light weight easy to hold
 Xmas gift,5,Bought for my mum for Xmas on a deal looks good
 Not happy,1,The best features are the battery which lasts ages and I do read a lot and it's very light to hold. 
" Adverts everywhere, even when off",2,Mistakenly choose Kindle and did not choose without advertising. When off the kindle is now a billbo
 Easy to Use,4,Brought these in a lightning sale as I needed some new ear buds for the gym. These earbuds come with
 V Good for the price.,4,I bought these for use at the gym and didn't want to pay a fortune in case I didn't get on with them
 Great earbuds but not suitable for use when lying down,3,"They fit quite well in my ears (which are quite small) without falling out and they are comfortable,"
" A common problem, avoid!",1,After just 2 weeks the right bud will not charge; followed troubleshooting for both case and buds an
 Great Value,5,Got these for £44 and they are great. They look good and fit very well with great sound for the pric
 Just great,5,Best value buds on the market
 Great quality,5,Happy with this purchase.
 Crisp sound but poor bass.,2,"Bought these as they were apparently the best buy under £100 last year ,BUT I honestly don't know wh"
 Nice headphones,5,Very happy for the money. Good low price earphones
 Look good,4,I can’t review these as they are a gift
 Good Quality,4,A good product that does all you require to do. Recipe book gives you lots of options to try out.
 Ky kitchen assistant.,5,"Throw ingredients in and set dial, forget.Job done."
 A Very Disappointing Purchase,1,"I bought one of these about 8 months ago and have used it on about 10 occasions, usually on low sett"
 False advertising:,1,"This product is not 6.5ltrs as claimed, it is 6ltrs at best. Morphy Richards should be ashamed"
 Cooking,5,Great for cooking different dinners
 Fab,5,Love it to replace one that had the non stick coating which does not last like they say. This one is
 Does what it says,4,Good size for family and bulk cooking.
" Sold as 6.5 litre, yet only holds 4.5 litre filled to very brim!",1,"I ordered this as a replacement for my exact make & size 20 year old 1 . This looked way smaller, & "
 Satisfactory,1,Not bad but wxpensive
 Brilliant,5,"This was a great purchase and is one of the bigger slow cookers, it does exactly what it's meant to "
 Good,5,Quality
 Useless,1,Worked for a bit but then kept coming up with an error code and it would just stop mid cook.Arranged
 Good cooking,5,Seems to everything very well. I like the link to the iPhone.
 Five Stars!,5,What a great bit of kit this is. I’ve been using this for several months now. I can say that I have 
 Works great,5,I have been using this product for all most 6 months. And it did not disappoint me. I am very happy 
 good product,5,useful product and value for money
 Not had to use oven since we got this,5,I was sceptical but this is a brilliant way of cooking love it
 Healthy eating,5,Love it
 Great Fryer,5,"Great Fryer, replacing my 10y old Philips, you definitely need to go for the XL, as I had to return "
 Great Airfryer,5,While I love this Airfryer - it does the job and very well at that - it is difficult to use without 
 Cup indicator failed,1,Cup indicator light failed
 The quality,5,"This kettle is great, the thing I like about it is there's no steam from it when boiled and it does "
 Ninja kettle,5,"As expected , this kettle is ninja 100% .I was pleasantly surprised when I switched it on for the fi"
 Good brew,5,Amazing though a little noisy good size makes very hot tea. Worth the money if you like tea or coffe
 Surprisingly Good,5,Having had a Cuisinart kettle for the past 8 years it was time to replace it. After much research I 
 It gets very hot,5,It’s gets very hot makes the best cup of tea
 Fantastic,5,Holds the temperature keeps clean performance is fantastic all of the above
 Keeps cutting out,1,"The kettle keeps saying its ""dry"" had the problem after a few months, then started working again, no"
 Brilliant,5,All round genuine quality product
 Perfect kettle,5,I thought with it having a smaller circumference that it would take much longer to boil.Absolutely n
 Speed,4,Brilliant that the card comes in a cute tin.
 Great Gift for Birthdays and Christmas,5,I buy this mostly for birthday and Christmas presents It's a great way to allow loved ones and frien
 great product,3,great
 GREAT IDEA,5,Birthday lady is well pleased with this novel idea.
 Tinned gift card,5,"It does what it says on the tin! Ha, ha."
 Great idea,5,"Excellent,what a surprise when my friend opened the tin,not expecting a Amazon voucher"
 Present for Wife,5,Think my Wife will like it!
 Amazon gift card holder tin,5,I bought this for my friend's birthday it arrived in the lovely tin with balloons design on it. So n
 very good,5,very pretty box a way to send a gift card.
 What a great present!,5,For the person who is very difficult to buy for these gift cards are such a great present. I buy and
 Expired film,1,"I paid retail price for film that produced maybe 1 ""usable"" image. All photos slightly discoloured, "
 Awful Film!!,1,"As a photography enthusiast, I recently decided to try a pack of bad Polaroid film out of sheer curi"
 Exactly as described,5,Perfect item. Exactly as described. One of the only places I could find this film as it is quite har
 Great product and equally fabulous puctures,4,Bought as a gift as it affords great pictures at a competitive price!
 Damaged Product,1,"The polaroid film cartridge is rusted, causing damage to the films inside. Every single picture came"
 Not bad quality... nice for the sentimental value,3,These are not bad... the picture quality is good if you follow the directions properly and leave it 
 It is what it is,5,Exactly what i was looking for 👍🏼
 Good,5,Very good
 Best Value,5,Best value I've found for this type of film.
 RUINED FILM,1,The film is ruinedIm doing everything right but the film is proper messedDissatisfied because im a s
 Excellent customer service,5,My appliance stopped working and Levoit promptly replaced it.
 Improved my sleep,2,With a drop of lavender oil it helps me sleep so much better
" It's nice, but it's a nightmare to get it cleaned",3,"It's nice, but it's a nightmare to get it cleaned"
 Cools air helps sleep,4,Bought to purify the air but was brilliant at cooling the room in hot weather
 Smell,2,"The smell is horrible. No matter what essential oil you put in, you can still feel the smell of plas"
 Enjoying my humidifier,5,"Low noise (was criticalto me), good performance, simple but nice design. Easy to use following the i"
 It's a wonderful product!!!,5,It was a nice purchase!!!! I am going to buy the air purifier of the same brand soon!!
 Great purchase,5,This humidifier is great! I use it every night. Also love the light feature. It's the first humidifi
 Does exactly what it says,5,Easy to use. Easy to clean and works perfectly
 Brilliant,5,"I bought this a few week ago, love it, use it daily, beneficial for health, better nights sleep. Eve"
 It didn't work on arrival,1,It didn't work on arrival.
 Excellent gift,5,My children love harry potter. Great gift
 Happy child,5,My sister was very happy to receive this hat as she is Harry Potter mad. She loves it and thinks it’
 Easy to use product good value,5,Great fun for grandchildren into Harry Potter
 Brilliant,5,"So realistic, mouth moves and voice clear. Bought for grandson’s birthday and he absolutely loves it"
" Malfunctioned after 4 hrs , couldn’t use so disappointing",1,"Hat looks great, sounds great, stopped working started stuttering first part of one word over and ov"
" Fun sorting hat, with 15 phrases and movement.",4,I got this for my daughter who is a huge Harry Potter fan and she was delighted by it. It requires 3
 Best Christmas buy,5,I’m not a H P fan but was fascinated by the Sorting Hat it speaks 2 languages and it’s lips move…
 It's magic,5,I purchased this for a friends 7 year old son as a birthday gift. He was so excited and the hat did 
 My granddaughter loves it,5,A bit too heavy
 Xmas gift,5,It looks good.
 Great,5,11 year old enjoyed putting this together
 Bought as present for 7 year old.,4,Good interesting present for 7 yr old.
 Can't finish model due to design and doesn't look great,2,"After buying and putting together their shuttle model, which was enjoyable and the end model looks g"
 Basic,3,Not impressed
 Fast replacement item.,4,I got this Clementoni hypercar a couple of weeks ago and also got the RC police car. On building the
 Utter dross,2,So many leftovver pieces and parts. A huge waste of plastic. The stickers don't line up. Very basic 
 Good value and quality,5,"Bought for my grandson, he loves itGood price & quality"
 Poor quality,1,Products like this one are really useful to build once in a while so you can appreciate how good Leg
 Grandson loves it,5,"Bought this for my 9 year old grandson. He loves it, loves to see how things work. Will definitely b"
 Great,5,Have this above my garage door. It gives a good light when I drive up
" Lepro Security Lights Outdoor...Nice and slim, very bright.",3,"Lepro Security Lights Outdoor...The light itself is very good, slim and very bright.The downside is,"
 Broke after 10 months,1,Made in China. Broke after 10 months. Need to get an electrician to refit. Buying these lights from 
 100 percent good..,4,"Good,,,"
 Excellent Quality,5,"This light is very well made, really impressed with the quality, easy to install, very powerful ligh"
 It doesn’t work…!!,4,This product is useless! Which ever setting I set it to the light only works when I hold my hand com
 Great product,5,Top seller high quality product
 Big value on a small item,5,This security light has helped in improving security and an asset when working outside affter dark.
 Outside PIR light,4,Excellent good illumination smart look energy efficient
 Perfect Security Light,5,Well made item to withstand the elements. Easy to install and set up giving a nicebright light.
 Good vacume cleaner,5,"Easy to use on the floors and carpets, not so good to empty the dust out."
 Easily as good as a Dyson for much less cost,5,An excellent hoover. Bought this for my Mum who is elderly and was struggling with a big old panason
 Vax,4,Does what it says on the box plus a bit more #excellent
" This product really sucks (in a good way!), expensive battery.",5,Learn how to wash the filters and clean it to restore its ability to change the colour of your carpe
 Avoid,1,"Ordered the product, got it and it didn't work. It would turn on then after 2 seconds turn itself of"
 Money well spent,5,Well worth the money
 Light and easy to use!,5,"Light, easy to use and so much more flexible and versatile than my previous larger cleaner. The prev"
 Lightweight cleaner,5,Great cleaner on hard floors and carpets. Has a good run time before needing to be recharged
 Confused!,3,This was a little bit heavier than expected to use. Arm got sore very soon after using on carpets.
 Battery power,5,The suction control is great and it is easy to clean are really good features. My only complaint is 
 Nice,5,Color
 Good for the price and included postage.,4,Love my throw.Its just the right size .Light but cosy and warm.Pretty colour too.
" They are massive, good vfm",5,"So big, really good vfm"
 Excellent,5,"Excellent, beautifully soft, light weight, washed gorgeously stayed soft fluffy dried in tumble drye"
 Does not wash well,1,After washing the blanket it looked really bad. I donated it to the puppy basket. Do not wash it as 
 Throw,5,Cozy couch throw
 Lovely Throw,5,Exactly as pictured & described
 Very small even for single bed.,1,"Small and not very good quality, The size is the main reason, barely fits single bed."
 So soft,4,I got 2 as throws for my sofas. They were just the right size and so soft but my son has taken one f
 Soft but ruined after a wash,3,Good for the price but didn't handle a wash very well. Pay more for a better quality or do in a cool
 Nice gift for a birthday boy,5,"He loves it, nice gift for a birthday boy. Arrived on good timing and excellent service, thank you"
 Love it,5,My kids love it
 Bought as a gift,5,Child very happy with toy
 Wizards love,5,"Oh what fun. The girls we bought it for loved it. The down load of the app, was easier than expected"
 amazing,5,Really enjoyed for christmas works perfectly
 Harry Potter Pictionary,4,Basically once you figure out how to get it to stream to your tv via mirroring it’s great for older 
" Doesn’t work ,",1,"Bought for my daughter for Christmas , wand doesn’t work the top did not turn green soIt was complet"
 Works well with Apple products,5,It works well with an iPad and Apple tv. We had fun playing with this at Christmas. No lag or connec
 Fabulous,5,"Great game for the Harry potter enthusiast! Bought for a present, great fun, well impressed"
" Glitches, awkward to use.",1,Have to hold phone / Tablet your casting then to TV as you draw.Mine draws all be itself.... stupid 
 Perfect fit,5,Love the colour and fit. Easy to use. No more dripping hair
 No frizz,5,I love this hair wrap. It left my hair super sleek with no frizz. I wish I had discovered these year
 Errr not sure about this,1,This is suppose to help with curly hair - don’t be fooled and waste your money it doesn’t work
 Fit,5,Easy to use and pretty
 Looks nice but it is very thin and not that Absorbent.,3,I have shoulder length hair and it only just fits into this. I twisted it twice then tried to button
 Perfect for curls,5,"Used this for over a month now and wouldn’t use anything else, it’s really light weight and really a"
 Disappointed,1,"Wanted a thin hair towel. This is thin, nice colour but it doesn’t dry hair enough. Used a few times"
 Best purchase,5,I am a swimming teacher and bought this to dry my hair off when I get out the pool. It’s excellent a
 Could be better but does the job I bought it for,4,"I bought this in several colours to take to the swimming pool with me. It could be more absorbent, b"
 The turban for protecting hair,5,I was looking for a turban to protect hair when I apply and remove make up. It is exactly perfect fo
 Great,5,Looks really good
 Good value and look great around kids bedroom,5,Easy to put up and use
 Great price,5,Very well made easy to install lots of choices on the remote
 Very flimsy connections,3,"They are good if you run then without cutting and connecting, if you want to connect them using 4 pi"
 Delivery on time,5,Dose the job well
 Led 5mtrs lights,5,Everything very good really pleased will buy again amazing flexibility of use on this set
 Very nice,5,Very nice and bright.
 Must have,5,I’ve had these led lights for 2 years (I know writing this review a bit late lol) and moved them ove
 Led lights,5,Very very good thank you so much...
 Very Good,5,I love each product
 That it is a gift card,5,Bought this for a friend and it was gratefully received.
 Attractive gift,5,Nice flowery gift card holder. You feel you have sent flowers and a gift all in one.
 Pretty,5,Ideal for the person who’s difficult to buy for
 Lovely card,5,"Arrive on time, good for gifting"
 Personal message requested was not there,3,I asked for words to be added because this was a birthday gift but it came with no words. I did feel
 That this the most appropriate gift.,5,There is not anything that I disliked about this gift voucher. It was most appropriate for purpose.
 Great,5,Arrived quickly. You can't go wrong with the gift card if you do not have idea what to buy. I love f
 Super cute,5,Lovely gift card
 Very pretty gift voucher,5,Very pretty gift voucher would buy again.
 Perfect,5,Pretty gift card
 It does the job,4,"The instructions are ok but when I try to alter the crust darkness, it does not change. I had a coup"
 Brilliant!,5,This is a review of the Panasonic basic SD-B2510 Automatic bread maker. We bought it as it was the #
 Works as expected,5,"Makes good bread. We use the XL setting with medium size bread ingredients, and it comes out huge. N"
 takes ages,2,"Bought, read instructions, never used. This is my third breadmaker and it was bought following the e"
 Qlty,5,Great thanks
 Perfect bread easy to operate,5,Bread making
 Gluten free = Great!,5,This makes amazing crusty gluten free loaves if you get it right. I do a medium size loaf (500g of f
 Disappointing bread,2,"We read many reviews that said this machine makes the best bread. So far it has not, despite followi"
" Easy to use, great bread!",5,Did a lot of research before buying and decided this model (SDB2510) met all our requirements at the
 It’s difficult to see the controls,1,This is my 3rd Panasonic bread machine and it is the worst one the controls are difficult to see unl
 Lightweight,5,"A lightweight, compact, easy-to-use vacuum cleaner at a good price. Very satisfied."
 Powerful suction & lightweight to use.,5,"Highly recommend this Russell Hobbs vacuum cleaner. Very lightweight to use, comes with complete set"
 Keeps up with the Jones's!,5,"If you want a Dyson but can't afford one, then purchase this. Very good for a small flat, would need"
 Excellent to use and manage,5,"This vacuum is the best to manoeuvre and lightweight for arthritic hands, am enjoying the ease of us"
 Vacuum cleaner,5,"Came very quickly, does the job"
 Very happy so far,5,"Have been using this vacuum for several weeks now and I'm very pleased. Good value for money, no bag"
 Works fine and value for money,4,"Works fine, you get what you pay for. It's been fine and I have now had it for almost 10 months it w"
" Very good compact, powerful, easy to clean",5,
 Poor,2,Poor quality..I dont think it will last very long..on the plus side..easy to empty
" poor quality, poor suction",1,"I thought that at a fraction of the price of one of the leading brands, even if this didn't last as "
" COSORI Smart Air Fryer Oven Dual Blaze 6.4L, Double Heating Elements",5,I have 2 Cosori Duel Blaze 6.4 Air fryers also a Cosori Air Fryer Oven and I use them all every day 
 Larger then I thought,4,Very compact nice looking air fryer very good value for money
 Top notch product,5,"Had a similar air fryer to the cosori a few months back and it died on me , so gave this a try and i"
 Excellent Product,5,Much easier to use than a standard oven and very pleased with this air fryer. Corsori has excellent 
 Absolute Game Changer,5,"Having owned one of these for year this really is a phenomenal piece of kit, ever since owning one o"
 Would definitely recommend,5,"Cost effective, looks good, nice touch screen display and cooks food as well as any oven I’ve used."
 Goodbye Oven,5,My friend had bought this product and had used it to cook a meal. I was surprised as the crispy but 
 Game changer,5,"Bought this as an extra Air Fryer, lovely large basket, bottom heating element a game changer, not a"
 Amazing,5,For the price this is far superior to the more well known brands. It looks good and great performanc
 Petfect,5,Perfect purchase
 It does not work. No Mist,1,
 It's ok,3,This looks quite nice but is a bit bigger than I expected. It's nicely made and easy to use. It's no
 Can not smell,2,Not as good as the reviews iv read. Can hardly smell. I actually thought this was a difuser and orde
 Smell is lovely.,4,The smell is lovely and very quiet. However I keep forgetting to set it at night!
 the smell is lovely,4,some thing that really works i have trouble sleeping but this item gave me a full nights sleep
 Didn’t last long,1,"Bought from the Yankee shop and was impressed with the quality but after a month, i noticed it was l"
 Not what i thought,3,Not what i thought its not constance mist every 5/10 mins
 Helps me to relax,5,Helps me to relax. Others have said they like and enjoy it.
 Not worth it. Sort of.,2,I'm giving two parts to this review because it's worth explaining why this product is fundamentally 
 Does not work,1,Not the best air diffuser. Don’t waste your money
" Not impressed, it has very weak suction power and non-intelligent logic behind",3,"Not impressed, it has very weak suction power leaving many small dust parts behind. It does not have"
 Power button fails on multiple devices,1,"The power button failed on 3 of these M210B robot vacuums. Sent 1 back, same thing happened on repla"
 My cleaner,5,"Fantastic! I go out, come home and everywhere is spotless… and I don’t have to pay the cleaner lolol"
 I love it!,5,"Easy to use and gets to all the places I can’t with the upright; under the bed, sofas, wardrobe etc"
 Does the job,4,
 Great product at the price point,5,I had a different one previously and this outperforms it at a cheaper price point.Overall very pleas
 Fantastic item,5,Fantastic hover ideal for use on dog hair would highly recommend long battery life and surprisingly 
 Just amazing,5,I have a silver lab so she coats my light flooring in her fur...this machine is a game changer. I ca
" Lovely little robot, but not the brightest",4,"Beautiful little robot, I’ve named mine Salvador, as his bristles remind me of Dali. He works hard, "
 It actually works,5,"We love our wee robot, you will not believe the amount of dust and hair it gets. We set it for when "
